{
  "eventId": "evt_orderattributionadjusted_001",
  "eventType": "OrderAttributionAdjusted",
  "schemaVersion": 1,
  "occurredAt": "2026-08-10T02:00:00Z",
  "publishedAt": "2026-08-10T02:00:01Z",
  "producer": "SYS-02",
  "environment": "DEV",
  "audience": [
    "SYS-04",
    "SYS-06",
    "SYS-08"
  ],
  "enterpriseId": null,
  "aggregateType": "OrderAttribution",
  "aggregateId": "atr_contract_001",
  "aggregateVersion": 2,
  "traceId": "trace_contract_fixture_001",
  "causationId": null,
  "correlationId": "corr_contract_fixture_001",
  "idempotencyKey": "ORDER_ATTRIBUTION_ADJUST:adj_contract_001:2",
  "payload": {
    "orderId": "ord_contract_001",
    "subOrderId": "subord_contract_001",
    "attributionId": "atr_contract_001",
    "adjustmentId": "adj_contract_001",
    "oldVersion": 1,
    "newVersion": 2,
    "oldSellerEnterpriseId": "ent_contract_001",
    "newSellerEnterpriseId": "ent_contract_001",
    "oldPromoterEnterpriseId": null,
    "newPromoterEnterpriseId": "ent_contract_002",
    "oldMembershipOwnerEnterpriseId": "ent_contract_001",
    "newMembershipOwnerEnterpriseId": "ent_contract_001",
    "oldDistributionRuleVersionId": null,
    "newDistributionRuleVersionId": "dru_contract_001",
    "oldDistributionContextStatus": "PENDING_DISTRIBUTION_RULE",
    "newDistributionContextStatus": "RESOLVED",
    "oldSnapshotHash": "1111111111111111111111111111111111111111111111111111111111111111",
    "newSnapshotHash": "2222222222222222222222222222222222222222222222222222222222222222",
    "approvalRef": "approval_contract_001",
    "effectiveAt": "2026-08-10T02:00:00Z"
  }
}
